{
  "$schema": "data-structures/schema/vm-model.schema.json",
  "schemaVersion": 1,
  "kind": "vm-model",
  "enums": {
    "vm_action_scope_e": {
      "alias": "Action Scope",
      "source_file": "components/VM/blocks/action/vm_block_action.h",
      "members": [
        {
          "name": "VM_ACTION_SCOPE_STATIC",
          "value": 0,
          "alias": "Static",
          "description": "A built-in action (freeze, safe state, device reset, ...)"
        },
        {
          "name": "VM_ACTION_SCOPE_RECORDED",
          "value": 1,
          "alias": "Recorded",
          "description": "A recorded packet sequence"
        }
      ]
    },
    "vm_expr_op_e": {
      "alias": "Expression Opcode",
      "source_file": "components/VM/blocks/expr_core/vm_expr_core.h",
      "members": [
        {
          "name": "VM_EXPR_END",
          "value": 0,
          "alias": "end",
          "description": "Stop; the rest of the code is ignored."
        },
        {
          "name": "VM_EXPR_IN",
          "value": 1,
          "alias": "in",
          "description": "-> input[operand] (as float)"
        },
        {
          "name": "VM_EXPR_K",
          "value": 2,
          "alias": "const",
          "description": "-> constant[operand]"
        },
        {
          "name": "VM_EXPR_DUP",
          "value": 3,
          "alias": "dup",
          "description": "a -> a a"
        },
        {
          "name": "VM_EXPR_DROP",
          "value": 4,
          "alias": "drop",
          "description": "a ->"
        },
        {
          "name": "VM_EXPR_SWAP",
          "value": 5,
          "alias": "swap",
          "description": "a b -> b a"
        },
        {
          "name": "VM_EXPR_ADD",
          "value": 6,
          "alias": "+",
          "description": "a b -> a + b"
        },
        {
          "name": "VM_EXPR_SUB",
          "value": 7,
          "alias": "-",
          "description": "a b -> a - b"
        },
        {
          "name": "VM_EXPR_MUL",
          "value": 8,
          "alias": "*",
          "description": "a b -> a * b"
        },
        {
          "name": "VM_EXPR_DIV",
          "value": 9,
          "alias": "/",
          "description": "a b -> a / b (b = 0 faults)"
        },
        {
          "name": "VM_EXPR_MOD",
          "value": 10,
          "alias": "mod",
          "description": "a b -> fmod(a, b) (b = 0 faults)"
        },
        {
          "name": "VM_EXPR_POW",
          "value": 11,
          "alias": "pow",
          "description": "a b -> a to the power b (a < 0 with fractional b faults)"
        },
        {
          "name": "VM_EXPR_ROOT",
          "value": 12,
          "alias": "root",
          "description": "a b -> b-th root of a (b = 0 faults; a < 0 needs an odd integer b)"
        },
        {
          "name": "VM_EXPR_MIN",
          "value": 13,
          "alias": "min",
          "description": "a b -> the smaller"
        },
        {
          "name": "VM_EXPR_MAX",
          "value": 14,
          "alias": "max",
          "description": "a b -> the larger"
        },
        {
          "name": "VM_EXPR_ATAN2",
          "value": 15,
          "alias": "atan2",
          "description": "y x -> atan2(y, x), radians"
        },
        {
          "name": "VM_EXPR_HYPOT",
          "value": 16,
          "alias": "hypot",
          "description": "a b -> sqrt(a*a + b*b)"
        },
        {
          "name": "VM_EXPR_NEG",
          "value": 17,
          "alias": "neg",
          "description": "a -> -a"
        },
        {
          "name": "VM_EXPR_ABS",
          "value": 18,
          "alias": "abs",
          "description": "a -> |a|"
        },
        {
          "name": "VM_EXPR_SQRT",
          "value": 19,
          "alias": "sqrt",
          "description": "a -> square root (a < 0 faults)"
        },
        {
          "name": "VM_EXPR_SQUARE",
          "value": 20,
          "alias": "sq",
          "description": "a -> a * a"
        },
        {
          "name": "VM_EXPR_RECIP",
          "value": 21,
          "alias": "1/x",
          "description": "a -> 1 / a (a = 0 faults)"
        },
        {
          "name": "VM_EXPR_FLOOR",
          "value": 22,
          "alias": "floor",
          "description": "a -> round down"
        },
        {
          "name": "VM_EXPR_CEIL",
          "value": 23,
          "alias": "ceil",
          "description": "a -> round up"
        },
        {
          "name": "VM_EXPR_ROUND",
          "value": 24,
          "alias": "round",
          "description": "a -> round half away from zero"
        },
        {
          "name": "VM_EXPR_TRUNC",
          "value": 25,
          "alias": "trunc",
          "description": "a -> round toward zero"
        },
        {
          "name": "VM_EXPR_SIGN",
          "value": 26,
          "alias": "sign",
          "description": "a -> -1, 0 or 1"
        },
        {
          "name": "VM_EXPR_SIN",
          "value": 27,
          "alias": "sin",
          "description": "a -> sin(a), radians"
        },
        {
          "name": "VM_EXPR_COS",
          "value": 28,
          "alias": "cos",
          "description": "a -> cos(a), radians"
        },
        {
          "name": "VM_EXPR_TAN",
          "value": 29,
          "alias": "tan",
          "description": "a -> tan(a), radians"
        },
        {
          "name": "VM_EXPR_ASIN",
          "value": 30,
          "alias": "asin",
          "description": "a -> asin(a) (|a| > 1 faults)"
        },
        {
          "name": "VM_EXPR_ACOS",
          "value": 31,
          "alias": "acos",
          "description": "a -> acos(a) (|a| > 1 faults)"
        },
        {
          "name": "VM_EXPR_ATAN",
          "value": 32,
          "alias": "atan",
          "description": "a -> atan(a)"
        },
        {
          "name": "VM_EXPR_EXP",
          "value": 33,
          "alias": "exp",
          "description": "a -> e to the power a"
        },
        {
          "name": "VM_EXPR_LOG",
          "value": 34,
          "alias": "ln",
          "description": "a -> natural log (a <= 0 faults)"
        },
        {
          "name": "VM_EXPR_LOG10",
          "value": 35,
          "alias": "log10",
          "description": "a -> base-10 log (a <= 0 faults)"
        },
        {
          "name": "VM_EXPR_LOG2",
          "value": 36,
          "alias": "log2",
          "description": "a -> base-2 log (a <= 0 faults)"
        },
        {
          "name": "VM_EXPR_DEG",
          "value": 37,
          "alias": "deg",
          "description": "a -> radians to degrees"
        },
        {
          "name": "VM_EXPR_RAD",
          "value": 38,
          "alias": "rad",
          "description": "a -> degrees to radians"
        },
        {
          "name": "VM_EXPR_LT",
          "value": 39,
          "alias": "<",
          "description": "a b -> a < b"
        },
        {
          "name": "VM_EXPR_LE",
          "value": 40,
          "alias": "<=",
          "description": "a b -> a <= b"
        },
        {
          "name": "VM_EXPR_GT",
          "value": 41,
          "alias": ">",
          "description": "a b -> a > b"
        },
        {
          "name": "VM_EXPR_GE",
          "value": 42,
          "alias": ">=",
          "description": "a b -> a >= b"
        },
        {
          "name": "VM_EXPR_EQ",
          "value": 43,
          "alias": "==",
          "description": "a b -> a == b (exact)"
        },
        {
          "name": "VM_EXPR_NE",
          "value": 44,
          "alias": "!=",
          "description": "a b -> a != b (exact)"
        },
        {
          "name": "VM_EXPR_AND",
          "value": 45,
          "alias": "and",
          "description": "a b -> a and b"
        },
        {
          "name": "VM_EXPR_OR",
          "value": 46,
          "alias": "or",
          "description": "a b -> a or b"
        },
        {
          "name": "VM_EXPR_XOR",
          "value": 47,
          "alias": "xor",
          "description": "a b -> exactly one of a, b"
        },
        {
          "name": "VM_EXPR_NOT",
          "value": 48,
          "alias": "not",
          "description": "a -> not a"
        },
        {
          "name": "VM_EXPR_SEL",
          "value": 49,
          "alias": "select",
          "description": "c t f -> t if c is non-zero, else f"
        },
        {
          "name": "VM_EXPR_OP_CNT",
          "value": 50,
          "alias": null,
          "description": null
        }
      ]
    },
    "vm_bit_op_e": {
      "alias": "Bit Expression Opcode",
      "source_file": "components/VM/blocks/expr_core/vm_expr_core.h",
      "members": [
        {
          "name": "VM_BIT_END",
          "value": 0,
          "alias": "end",
          "description": "Stop; the rest of the code is ignored."
        },
        {
          "name": "VM_BIT_IN",
          "value": 1,
          "alias": "in",
          "description": "-> input[operand] (as u32)"
        },
        {
          "name": "VM_BIT_K",
          "value": 2,
          "alias": "const",
          "description": "-> constant[operand]"
        },
        {
          "name": "VM_BIT_DUP",
          "value": 3,
          "alias": "dup",
          "description": "a -> a a"
        },
        {
          "name": "VM_BIT_DROP",
          "value": 4,
          "alias": "drop",
          "description": "a ->"
        },
        {
          "name": "VM_BIT_SWAP",
          "value": 5,
          "alias": "swap",
          "description": "a b -> b a"
        },
        {
          "name": "VM_BIT_AND",
          "value": 6,
          "alias": "&",
          "description": "a b -> a AND b"
        },
        {
          "name": "VM_BIT_OR",
          "value": 7,
          "alias": "|",
          "description": "a b -> a OR b"
        },
        {
          "name": "VM_BIT_XOR",
          "value": 8,
          "alias": "^",